{
  "schema_version": "1.0.0",
  "palette_id": "gugong-traditional-v2-final",
  "display_name": "中国传统色第二版终审色表",
  "color_space": "sRGB",
  "source": {
    "title": "《中国传统色：故宫里的色彩美学》第二版",
    "authors": [
      "郭浩",
      "李健明"
    ],
    "publisher": "中信出版社",
    "conversion": "终审色表结构化导入；RGB为运行屏幕基色；HEX/Oklab/亮度由加载器派生",
    "note": "色表保留书名和书中页码，供来源查询。"
  },
  "colors": [
    {
      "color_id": "002001",
      "name": "栀子",
      "rgb": {
        "R": 250,
        "G": 192,
        "B": 61
      },
      "enabled": true,
      "metadata": {
        "cmyk": {
          "C": 0,
          "M": 30,
          "Y": 80,
          "K": 0
        }
      },
      "source": {
        "page": "025"
      }
    },
    {
      "color_id": "002002",
      "name": "黄琉璃",
      "rgb": {
        "R": 229,
        "G": 168,
        "B": 75
      },
      "enabled": true,
      "metadata": {
        "cmyk": {
          "C": 10,
          "M": 40,
          "Y": 75,
          "K": 0
        }
      },
      "source": {
        "page": "017"
      }
    },
    {
      "color_id": "002003",
      "name": "金珀",
      "rgb": {
        "R": 217,
        "G": 136,
        "B": 61
      },
      "enabled": true,
      "metadata": {
        "cmyk": {
          "C": 15,
          "M": 55,
          "Y": 80,
          "K": 0
        }
      },
      "source": {
        "page": "089"
      }
    },
    {
      "color_id": "002004",
      "name": "缃叶",
      "rgb": {
        "R": 236,
        "G": 212,
        "B": 82
      },
      "enabled": true,
      "metadata": {
        "cmyk": {
          "C": 10,
          "M": 15,
          "Y": 75,
          "K": 0
        }
      },
      "source": {
        "page": "005"
      }
    },
    {
      "color_id": "002005",
      "name": "雌黄",
      "rgb": {
        "R": 233,
        "G": 195,
        "B": 80
      },
      "enabled": true,
      "metadata": {
        "cmyk": {
          "C": 10,
          "M": 25,
          "Y": 75,
          "K": 0
        }
      },
      "source": {
        "page": "081"
      }
    },
    {
      "color_id": "002006",
      "name": "黄白游",
      "rgb": {
        "R": 255,
        "G": 247,
        "B": 153
      },
      "enabled": true,
      "metadata": {
        "cmyk": {
          "C": 0,
          "M": 0,
          "Y": 50,
          "K": 0
        }
      },
      "source": {
        "page": "005"
      }
    },
    {
      "color_id": "002007",
      "name": "土黄",
      "rgb": {
        "R": 219,
        "G": 156,
        "B": 94
      },
      "enabled": true,
      "metadata": {
        "cmyk": {
          "C": 15,
          "M": 45,
          "Y": 65,
          "K": 0
        }
      },
      "source": {
        "page": "089"
      }
    },
    {
      "color_id": "002008",
      "name": "杏黄",
      "rgb": {
        "R": 217,
        "G": 135,
        "B": 0
      },
      "enabled": true,
      "metadata": {
        "cmyk": {
          "C": 15,
          "M": 55,
          "Y": 100,
          "K": 0
        }
      },
      "source": {
        "page": "075"
      }
    },
    {
      "color_id": "002009",
      "name": "女贞黄",
      "rgb": {
        "R": 247,
        "G": 238,
        "B": 173
      },
      "enabled": true,
      "metadata": {
        "cmyk": {
          "C": 5,
          "M": 5,
          "Y": 40,
          "K": 0
        }
      },
      "source": {
        "page": "173"
      }
    },
    {
      "color_id": "002010",
      "name": "日辉",
      "rgb": {
        "R": 229,
        "G": 191,
        "B": 94
      },
      "enabled": true,
      "metadata": {
        "cmyk": {
          "C": 12,
          "M": 27,
          "Y": 69,
          "K": 0
        }
      },
      "source": {
        "page": "081"
      }
    },
    {
      "color_id": "002011",
      "name": "松花",
      "rgb": {
        "R": 255,
        "G": 238,
        "B": 111
      },
      "enabled": true,
      "metadata": {
        "cmyk": {
          "C": 0,
          "M": 5,
          "Y": 65,
          "K": 0
        }
      },
      "source": {
        "page": "005"
      }
    },
    {
      "color_id": "002012",
      "name": "黄不老",
      "rgb": {
        "R": 219,
        "G": 155,
        "B": 52
      },
      "enabled": true,
      "metadata": {
        "cmyk": {
          "C": 15,
          "M": 45,
          "Y": 85,
          "K": 0
        }
      },
      "source": {
        "page": "025"
      }
    },
    {
      "color_id": "002013",
      "name": "郁金裙",
      "rgb": {
        "R": 209,
        "G": 139,
        "B": 6
      },
      "enabled": true,
      "metadata": {
        "cmyk": {
          "C": 20,
          "M": 52,
          "Y": 100,
          "K": 0
        }
      },
      "source": {
        "page": "075"
      }
    },
    {
      "color_id": "002014",
      "name": "绢纨",
      "rgb": {
        "R": 236,
        "G": 224,
        "B": 147
      },
      "enabled": true,
      "metadata": {
        "cmyk": {
          "C": 10,
          "M": 10,
          "Y": 50,
          "K": 0
        }
      },
      "source": {
        "page": "173"
      }
    },
    {
      "color_id": "002015",
      "name": "谷黄",
      "rgb": {
        "R": 217,
        "G": 170,
        "B": 93
      },
      "enabled": true,
      "metadata": {
        "cmyk": {
          "C": 17,
          "M": 37,
          "Y": 68,
          "K": 0
        }
      },
      "source": {
        "page": "151"
      }
    },
    {
      "color_id": "002016",
      "name": "黄栗留",
      "rgb": {
        "R": 254,
        "G": 220,
        "B": 94
      },
      "enabled": true,
      "metadata": {
        "cmyk": {
          "C": 0,
          "M": 15,
          "Y": 70,
          "K": 0
        }
      },
      "source": {
        "page": "025"
      }
    },
    {
      "color_id": "002017",
      "name": "库金",
      "rgb": {
        "R": 225,
        "G": 138,
        "B": 59
      },
      "enabled": true,
      "metadata": {
        "cmyk": {
          "C": 10,
          "M": 55,
          "Y": 80,
          "K": 0
        }
      },
      "source": {
        "page": "017"
      }
    },
    {
      "color_id": "002018",
      "name": "柘黄",
      "rgb": {
        "R": 198,
        "G": 121,
        "B": 21
      },
      "enabled": true,
      "metadata": {
        "cmyk": {
          "C": 25,
          "M": 60,
          "Y": 100,
          "K": 0
        }
      },
      "source": {
        "page": "025"
      }
    },
    {
      "color_id": "002019",
      "name": "莺儿",
      "rgb": {
        "R": 236,
        "G": 223,
        "B": 128
      },
      "enabled": true,
      "metadata": {
        "cmyk": {
          "C": 10,
          "M": 10,
          "Y": 58,
          "K": 0
        }
      },
      "source": {
        "page": "201"
      }
    },
    {
      "color_id": "002020",
      "name": "堇色",
      "rgb": {
        "R": 211,
        "G": 170,
        "B": 90
      },
      "enabled": true,
      "metadata": {
        "cmyk": {
          "C": 13,
          "M": 32,
          "Y": 67,
          "K": 10
        }
      },
      "source": {
        "page": "155"
      }
    },
    {
      "color_id": "002021",
      "name": "嫩鹅黄",
      "rgb": {
        "R": 242,
        "G": 200,
        "B": 103
      },
      "enabled": true,
      "metadata": {
        "cmyk": {
          "C": 5,
          "M": 25,
          "Y": 65,
          "K": 0
        }
      },
      "source": {
        "page": "075"
      }
    },
    {
      "color_id": "002022",
      "name": "藤黄",
      "rgb": {
        "R": 218,
        "G": 146,
        "B": 51
      },
      "enabled": true,
      "metadata": {
        "cmyk": {
          "C": 15,
          "M": 50,
          "Y": 85,
          "K": 0
        }
      },
      "source": {
        "page": "151"
      }
    },
    {
      "color_id": "002023",
      "name": "赭黄",
      "rgb": {
        "R": 188,
        "G": 110,
        "B": 55
      },
      "enabled": true,
      "metadata": {
        "cmyk": {
          "C": 30,
          "M": 65,
          "Y": 85,
          "K": 0
        }
      },
      "source": {
        "page": "151"
      }
    },
    {
      "color_id": "002024",
      "name": "米色",
      "rgb": {
        "R": 235,
        "G": 213,
        "B": 108
      },
      "enabled": true,
      "metadata": {
        "cmyk": {
          "C": 10,
          "M": 15,
          "Y": 65,
          "K": 0
        }
      },
      "source": {
        "page": "173"
      }
    },
    {
      "color_id": "002025",
      "name": "芸黄",
      "rgb": {
        "R": 211,
        "G": 167,
        "B": 99
      },
      "enabled": true,
      "metadata": {
        "cmyk": {
          "C": 20,
          "M": 38,
          "Y": 65,
          "K": 0
        }
      },
      "source": {
        "page": "081"
      }
    },
    {
      "color_id": "002026",
      "name": "金漆",
      "rgb": {
        "R": 215,
        "G": 165,
        "B": 71
      },
      "enabled": true,
      "metadata": {
        "cmyk": {
          "C": 18,
          "M": 39,
          "Y": 78,
          "K": 0
        }
      },
      "source": {
        "page": "081"
      }
    },
    {
      "color_id": "002027",
      "name": "蛾黄",
      "rgb": {
        "R": 190,
        "G": 138,
        "B": 47
      },
      "enabled": true,
      "metadata": {
        "cmyk": {
          "C": 30,
          "M": 50,
          "Y": 90,
          "K": 0
        }
      },
      "source": {
        "page": "201"
      }
    },
    {
      "color_id": "002028",
      "name": "蜜合",
      "rgb": {
        "R": 234,
        "G": 216,
        "B": 154
      },
      "enabled": true,
      "metadata": {
        "cmyk": {
          "C": 10,
          "M": 15,
          "Y": 45,
          "K": 0
        }
      },
      "source": {
        "page": "131"
      }
    },
    {
      "color_id": "002029",
      "name": "圆眼",
      "rgb": {
        "R": 222,
        "G": 188,
        "B": 121